RAZAOSOCIAL;UF;Total_Geral;Media_Trimestral;Desvio_Padrao_Despesas
2CARE OPERADORA DE SAÚDE LTDA.;SP;411890291.78999996;137296763.92999998;72627822.57193086
ABERTTA SAÚDE - ASSOCIAÇÃO BENEFICENTE DOS EMPREGADOS DA ARCELORMITTAL NO BRASIL;MG;380795151.6;126931717.2;66838028.17187122
ADVANCE PLANOS DE SAÚDE LTDA;SP;43161916.91;14387305.636666665;7751227.983077572
AESP ODONTO ASSISTÊNCIA ODONTOLÓGICA S/S LTDA EPP;SP;7053734.99;2351244.9966666666;1349779.4662232883
AFFIX ADMINISTRADORA DE BENEFÍCIOS LTDA;SP;0.0;0.0;0.0
AGROS - INSTITUTO UFV DE SEGURIDADE SOCIAL;MG;153802313.06;51267437.68666667;27770587.106702987
ALICE OPERADORA LTDA.;SP;654594677.14;218198225.71333334;131512122.12051715
ALLIANZ SAÚDE S/A;SP;40487498.09;13495832.696666667;5702199.838694714
ALMA ODONTO OPERADORA DE PLANOS ODONTOLOGICOS LTDA;SP;792655.56;264218.52;121212.61202047375
ALVORECER - ASSOCIAÇÃO DE SOCORROS MÚTUOS;SP;465398684.48;155132894.82666668;78161226.0724695
AMAZÔNIA PLANOS DE SAÚDE LTDA;PA;90607567.52;30202522.506666664;16035352.898447266
AME VVIDA PLANOS DE SAUDE INTEGRADO LTDA.;RO;36574055.19;12191351.729999999;6063002.235167471
AME-ASSISTÊNCIA MÉDICA A EMPRESAS LTDA;MG;14756499.16;4918833.053333334;2440362.2084327685
AMEP FREGUESIA OPERADORA DE PLANO DE SAUDE LTDA;RJ;59139684.9;19713228.3;9869146.524035785
AMEPLAN ASSISTÊNCIA MÉDICA PLANEJADA LTDA;SP;113220482.56;37740160.85333333;18142364.07002126
AMESC - ASSOCIAÇÃO MÉDICA ESPÍRITA CRISTÃ;RJ;177480955.39;59160318.46333333;28380361.38057687
AMHA SAUDE S/A;SP;104644848.76;34881616.25333334;17382705.325629637
AMHE MED ASSISTENCIA A SAUDE LTDA - EPP;SP;120612567.03;40204189.01;30733876.440672435
AMIL ASSISTÊNCIA MÉDICA INTERNACIONAL S.A.;SP;37922963159.46;12640987719.82;6609060086.402223
AMPARA ASSISTÊNCIA MÉDICA PARAÍSO LTDA;MG;54195328.34;18065109.44666667;9364078.080960995
AMPLA PLANOS DE SAUDE LTDA;RJ;474281905.32;237140952.66;77060565.92833683
AMPLITUDE PLANOS DE SAUDE LTDA ;MG;0.0;0.0;0.0
ANAFE SAUDE;GO;81122122.6;27040707.53333333;13889011.91641743
ANGELI SISTEMAS DE SAUDE S.A.;PR;19257623.439999998;6419207.813333333;3543213.9207353424
ARL ADMINISTRADORA DE BENEFÍCIOS LTDA.;SP;5680.0;1893.3333333333333;1639.6747644985371
ASSISTÊNCIA MÉDICA 12 DE OUTUBRO LTDA;SP;696205.41;232068.47;141523.9511463639
ASSISTÊNCIA MÉDICA SÃO MIGUEL LTDA;SP;142014083.89;47338027.96333333;25603408.67441352
ASSOC DE ASSIST À SAÚDE DOS SERV DAS UNIV E INST FED, EST E/OU FAC PART EM PE;PE;4518150.75;1506050.25;610327.6914953234
ASSOCIACAO CIVIL PRÓ-SAÚDE DOS SERVIDORES DA UNIVERSIDADE ESTADUAL DE PONTA GROSSA;PR;13772291.1;4590763.7;2497912.802665345
ASSOCIACAO DE SAUDE HOLAMBRA;SP;19804339.03;6601446.343333334;3704785.928067927
ASSOCIACAO DOS AUDITORES FISCAIS DA RECEITA ESTADUAL DE SAO PAULO;SP;566091712.79;188697237.59666666;100806758.6543536
ASSOCIACAO DOS PROFESSORES UNIVERSITÁRIOS DA BAHIA;BA;44913714.730000004;14971238.243333334;8108971.090889649
ASSOCIACAO DOS SERVIDORES DA EMDAGRO - ASSEM;SE;7771778.41;2590592.803333333;1347632.720469211
ASSOCIACAO POLICIAL DE ASSISTENCIA A SAUDE DE ITAPETININGA;SP;13749839.58;4583279.86;2412452.955833878
ASSOCIACAO POLICIAL DE ASSISTENCIA A SAUDE DE PRESIDENTE PRUDENTE (APAS);SP;27555899.83;9185299.943333333;5015299.08519001
ASSOCIAÇAO DOS FUNCIONARIOS PUBLICOS DO ESTADO DO RIO GRANDE DO SUL;RS;150835034.39;50278344.79666666;25262748.303618636
ASSOCIAÇAO UNISAUDE MARAU;RS;30177843.880000003;10059281.293333335;4993869.075028375
ASSOCIAÇÃO ADVENTISTA NORTE BRASILEIRA DE PREVENÇÃO E ASSISTÊNCIA A SAÚDE;PA;207945240.66;69315080.22;34293831.465501405
ASSOCIAÇÃO ASSISTENCIAL DE SAÚDE SUPLEMENTAR CRUZ AZUL SAÚDE;SP;354986470.53;118328823.50999999;56116603.18400107
ASSOCIAÇÃO BENEFICENTE CATÓLICA;MG;16828337.77;5609445.923333333;2905590.116928358
ASSOCIAÇÃO BENEFICENTE DE ASSISTÊNCIA A SAÚDE DOS JUÍZES DO TRABALHO DA 15ª REGIÃO (ABAS 15);SP;181797246.89;60599082.29666666;31779325.63057411
ASSOCIAÇÃO BENEFICENTE DOS PROFESSORES PÚBLICOS ATIVOS E INATIVOS DO RIO DE JANEIRO - APPAI;RJ;159229813.43;53076604.47666667;29690743.94130263
ASSOCIAÇÃO DA SANTA CASA SAÚDE DE RIBEIRÃO PRETO;SP;207104608.93;69034869.64333333;35238979.465428375
ASSOCIAÇÃO DE ASSISTÊNCIA MÉDICO HOSPITALAR DOS MAGISTRADOS DO ESTADO DO PARANÁ;PR;111974923.48;37324974.49333333;21524049.304901864
ASSOCIAÇÃO DE ASSISTÊNCIA À SAÚDE DA AMAGIS;MG;132683142.21000001;44227714.07;24131208.79344476
ASSOCIAÇÃO DE ASSISTÊNCIA À SAÚDE DOS EMPREGADOS DA COPASA;MG;474860715.21;158286905.07;81409655.3526047
ASSOCIAÇÃO DE BENEFICÊNCIA E FILANTROPIA SÃO CRISTOVÃO;SP;1002972985.6199999;334324328.53999996;170809745.84725922
ASSOCIAÇÃO DE SAÚDE DO VALE;SC;122362738.43;40787579.47666667;23433126.93379574
ASSOCIAÇÃO DE SAÚDE DOS FORNECEDORES DE CANA DE PIRACICABA E REGIÃO;SP;115422240.27000001;38474080.09;20917279.659327045
ASSOCIAÇÃO DE SAÚDE PORTUGUESA DE BENEFICÊNCIA;SP;504677174.07;168225724.69;88270085.51009306
ASSOCIAÇÃO DO FISCO DE ALAGOAS;AL;69725674.6;23241891.53333333;13649836.842403192
ASSOCIAÇÃO DO PLANO DE SAÚDE DA SANTA CASA DE MISERICÓRDIA DE ITABUNA - PLANSUL;BA;105439253.91999999;35146417.97333333;17782645.949017864
ASSOCIAÇÃO DOS AUDITORES FISCAIS DA RECEITA ESTADUAL DO RIO DE JANEIRO;RJ;50207864.92;16735954.973333335;8409846.416635813
ASSOCIAÇÃO DOS AUDITORES FISCAIS DO ESTADO DA PARAÍBA - AFRAFEP;PB;78567423.02000001;26189141.00666667;13507131.278968086
ASSOCIAÇÃO DOS EMPREGADOS DA COMPANHIA ESTADUAL DE HABITAÇÃO E OBRAS PÚBLICAS - ASSEC;SE;45557752.58;15185917.526666665;8266588.398235579
ASSOCIAÇÃO DOS FISCAIS DE TRIBUTOS ESTADUAIS DO RS - AFISVEC;RS;4599453.970000001;1533151.3233333335;977421.4765159696
ASSOCIAÇÃO DOS FUNCIONÁRIOS DO FISCO DO ESTADO DE GOIÁS;GO;77522620.19;25840873.396666665;14034458.296135595
ASSOCIAÇÃO DOS FUNCIONÁRIOS FISCAIS DO ESTADO DO AMAZONAS - AFFEAM;AM;19492540.62;6497513.54;4192113.2456745673
ASSOCIAÇÃO DOS SERVIDORES FISCAIS DO ESTADO DA BAHIA;BA;174773620.18;58257873.39333334;31100419.57946835
ASSOCIAÇÃO DOS SERVIDORES MUNICIPAIS, ESTADUAIS E FEDERAIS DO RIO DE JANEIRO;RJ;18606757.95;6202252.649999999;3581081.5828938647
ASSOCIAÇÃO DOS SERVIDORES PÚBLICOS DA ADMINISTRAÇÃO DIRETA DO GOVERNO DO ESTADO DO PARÁ - ASPARÁ;PA;9552825.16;3184275.053333333;1602332.623143046
ASSOCIAÇÃO DR. BARTHOLOMEU TACCHINI;RS;385500393.99;128500131.33;72427685.84577434
ASSOCIAÇÃO EVANGELICA BENEFICENTE DE LONDRINA;PR;374050199.85;124683399.95;68745363.06122851
ASSOCIAÇÃO FCA SAÚDE;MG;233950300.90000004;77983433.63333334;43285575.07399286
ASSOCIAÇÃO FUNDO DE PROTEÇÃO À SAÚDE;PR;87200555.69;29066851.896666665;15377205.361695958
ASSOCIAÇÃO GOIANA DO MINISTÉRIO PÚBLICO;GO;40906531.97;13635510.656666666;7183223.185171991
ASSOCIAÇÃO HOSPITAL SAÚDE DE VARGEM GRANDE DO SUL;SP;8465552.530000001;2821850.8433333337;1326845.9546535546
ASSOCIAÇÃO MAIS SAÚDE SANTA CASA DE SÃO JOÃO DA BOA VISTA;SP;96593314.10000001;32197771.36666667;18627201.708368357
ASSOCIAÇÃO MINEIRA DE ASSISTÊNCIA À SAÚDE DOS MEMBROS DO MINISTÉRIO PÚBLICO;MG;108597203.43;36199067.81;19630937.3841875
ASSOCIAÇÃO PADRE ALBINO SAÚDE;SP;179748132.62;59916044.20666667;35702714.649512485
ASSOCIAÇÃO PADRE PIO PLANOS DE SAÚDE;SP;4125857.67;1375285.89;685047.4234154877
ASSOCIAÇÃO PARANAENSE DE ASSISTÊNCIA À SAUDE DOS MEMBROS DO MINISTERIO PUBLICO DO PARANÁ;PR;67536650.31;22512216.77;11362052.473717513
ASSOCIAÇÃO PETROBRAS DE SAÚDE - APS;RJ;8147006607.32;2715668869.1066666;1468199485.1621141
ASSOCIAÇÃO PLANO DE SAÚDE SANTA CASA DE VALINHOS;SP;51019148.81999999;17006382.939999998;9018794.760186488
ASSOCIAÇÃO POLICIAL DE ASSISTENCIA A SAUDE DE BOTUCATU;SP;7090575.779999999;2363525.26;1570425.820315525
ASSOCIAÇÃO POLICIAL DE ASSISTENCIA À SAUDE DE SAO JOAO DA BOA VISTA;SP;17438805.79;5812935.263333333;3107695.2601152263
ASSOCIAÇÃO POLICIAL DE ASSISTÊNCIA A SAÚDE;SP;22827004.36;7609001.453333333;3961347.848015887
ASSOCIAÇÃO POLICIAL DE ASSISTÊNCIA A SAÚDE DA BAIXADA SANTISTA;SP;42196759.14;14065586.38;6900907.147541856
ASSOCIAÇÃO POLICIAL DE ASSISTÊNCIA À SAÚDE;SP;116683970.15;12964885.572222224;11152989.495225912
ASSOCIAÇÃO POLICIAL DE ASSISTÊNCIA À SAÚDE - VALE DO RIBEIRA;SP;7547536.949999999;2515845.65;1176148.4566079355
ASSOCIAÇÃO POLICIAL DE ASSISTÊNCIA À SAÚDE APAS;SP;7526202.5600000005;2508734.186666667;871828.9618359617
ASSOCIAÇÃO POLICIAL DE ASSISTÊNCIA À SAÚDE DE ARAÇATUBA (APAS);SP;43619201.239999995;14539733.746666664;7284326.016238618
ASSOCIAÇÃO POLICIAL DE ASSISTÊNCIA À SAÚDE DE BARRETOS;SP;10199327.129999999;3399775.7099999995;1689447.151518818
ASSOCIAÇÃO POLICIAL DE ASSISTÊNCIA À SAÚDE DE BAURU;SP;91766703.82;30588901.27333333;16206192.366144337
ASSOCIAÇÃO POLICIAL DE ASSISTÊNCIA À SAÚDE DE DRACENA;SP;9715658.100000001;3238552.7000000007;1888484.9133608406
ASSOCIAÇÃO POLICIAL DE ASSISTÊNCIA À SAÚDE DE JAÚ;SP;7696399.380000001;2565466.4600000004;1144971.7457217749
ASSOCIAÇÃO POLICIAL DE ASSISTÊNCIA À SAÚDE DE PRESIDENTE VENCESLAU;SP;9814844.02;3271614.6733333333;1682442.249207324
ASSOCIAÇÃO POLICIAL DE ASSISTÊNCIA À SAÚDE DE RIBEIRÃO PRETO (APAS);SP;53001580.42999999;17667193.476666663;9022774.911292834
ASSOCIAÇÃO SANTA CASA CLÍNICAS DE BIRIGUI;SP;42018281.78;14006093.926666668;7432135.345503948
ASSOCIAÇÃO SANTA CASA SAÚDE DE ARAÇATUBA;SP;153753344.78;51251114.92666667;27512323.35359254
ASSOCIAÇÃO SANTA CASA SAÚDE DE SÃO JOSÉ DOS CAMPOS;SP;824036648.8700001;274678882.9566667;144495334.0220548
ASSOCIAÇÃO SANTA SAÚDE;SP;562059047.99;187353015.99666667;98584650.51629433
ASSOCIAÇÃO SAÚDE CONCEIÇÃO;SC;45491923.230000004;15163974.410000002;8254343.329035545
ASSOCIAÇÃO SAÚDE RURAL ALEGRETE;RS;9219814.32;3073271.44;1910728.5920275918
ASSOCIAÇÃO SAÚDE SÃO JOSÉ;SC;100029178.72999999;33343059.576666664;18433439.495013546
ASSOCIAÇÃO SERVIÇOS ODONTOLÓGICOS DA INDÚSTRIA DE MINAS GERAIS - ODONTOINDUSTRIA;MG;3896791.72;1298930.5733333335;713295.1443642305
ASSOCIAÇÃO SÃO FRANCISCO VIDA;SP;212704208.55;70901402.85000001;38802113.24643846
ASSOCIAÇÃO SÃO LUIZ SAÚDE;SP;91717430.84;30572476.94666667;14525579.18220299
ASSOCIAÇÃO UNIVIDA SANTA RITA DO PASSA QUATRO;SP;12663879.91;4221293.303333334;2093032.0629881334
ASSOCIAÇÃO VALEPARAIBANA DE ASSISTÊNCIA MÉDICA POLICIAL;SP;34974160.339999996;11658053.446666665;4763812.605522804
ATIMED ASSISTENCIA MEDICA LTDA;SP;0.0;0.0;0.0
ATITUDE SAÚDE ASSISTÊNCIA MEDICA LTDA;BA;26869399.240000002;8956466.413333334;5328734.892221309
ATÍVIA SERVIÇOS DE SAÚDE S/A;SP;41183754.04;20591877.02;4548378.640356314
AURORA SAÚDE LTDA;MG;30269982.009999998;10089994.003333332;6338541.0971020935
AUSTACLINICAS ASSISTÊNCIA MÉDICA E HOSPITALAR LTDA;SP;422421220.8;140807073.6;72378127.50308773
BCI ADMINISTRADORA DE BENEFÍCIOS LTDA.;SP;0.0;0.0;0.0
BEMSTAR ASSISTENCIA MEDICA LTDA;BA;916748.1100000001;305582.70333333337;99498.91165725654
BENEFICENCIA CAMILIANA DO SUL;SP;209505152.72;104752576.36;54954110.92620881
BENEFICENCIA SOCIAL BOM SAMARITANO;MG;6255717.28;2085239.0933333335;1257569.6906557523
BENSAUDE PLANO DE ASSISTENCIA MEDICA HOSPITALAR LTDA.;SP;515754947.37;171918315.79;86996499.58845314
BEST SENIOR OPERADORA DE SAÚDE LTDA;ES;117719337.13;39239779.04333333;23112618.678361118
BIO SAÚDE SERVIÇOS MÉDICOS LTDA;SP;36947461.650000006;12315820.550000003;5503753.0245704055
BIORAL SISTEMA ODONTOLÓGICO LTDA.;SP;0.0;0.0;0.0
BIOVIDA SAÚDE LTDA.;SP;401604330.65999997;133868110.21999998;68233643.05827911
BIT LIFE BENEFÍCIOS LTDA;SP;0.0;0.0;0.0
BLUZZ SAÚDE S/A;ES;2432983.38;810994.46;696813.099069973
BRADESCO SAÚDE - OPERADORA DE PLANOS  S/A;SP;8943310696.55;2981103565.5166664;1590870494.7204628
BRADESCO SAÚDE S.A.;RJ;71643287335.93;23881095778.64333;12558966894.14082
BRASIL ODONTO OPERADORA DE PLANOS ODONTOLÓGICOS LTDA;TO;1242569.19;414189.73;174059.08646069843
BRASILDENTAL OPERADORA DE PLANOS ODONTOLÓGICOS S.A.;SP;63563719.97;21187906.656666666;11188085.212950991
CABERJ INTEGRAL SAÚDE S.A;RJ;262487545.66000003;87495848.55333334;44664494.033641964
CAIXA ASSISTENCIAL E BENEFICENTE DOS FUNCIONÁRIOS DA ACARESC;SC;180707625.1;60235875.03333333;30668829.967473492
CAIXA ASSISTENCIAL UNIVERSITARIA DO RIO DE JANEIRO;RJ;19661734.36;6553911.453333333;3267206.056882041
CAIXA ASSISTENCIAL UNIVERSITÁRIA DO RIO GRANDE DO NORTE;RN;114005958.82;38001986.27333333;19951101.448354073
CAIXA BENEFICENTE DOS FUNCIONARIOS DO BANCO DO ESTADO DE SÃO PAULO;SP;2041637535.1799998;680545845.06;365380915.61094016
CAIXA BENEFICENTE DOS FUNCIONÁRIOS DO GRUPO IGUAÇU;PR;11444007.2;3814669.0666666664;1842932.8645257903
CAIXA DE ASSISTENCIA A SAUDE DA UNIVERSIDADE;MG;222509215.08999997;74169738.36333333;39404706.46177536
CAIXA DE ASSISTENCIA DOS SERVIDORES DO ESTADO DE MATO GROSSO DO SUL;MS;1416432005.6100001;472144001.87000006;239342930.83372286
CAIXA DE ASSISTÊNCIA AOS MEMBROS DA DEFENSORIA PÚBLICA DO ESTADO DO RIO DE JANEIRO;RJ;86611416.5;28870472.166666668;16276610.677002534
CAIXA DE ASSISTÊNCIA DO SINDFISCO - CASSIND;SE;36330123.129999995;12110041.043333331;6637033.555225478
CAIXA DE ASSISTÊNCIA DOS EMPREGADOS DA EMPRESA BRASILEIRA DE PESQUISA  AGROPECUÁRIA;DF;361657949.45000005;120552649.81666668;66514130.06082567
CAIXA DE ASSISTÊNCIA DOS EMPREGADOS DA SANEAGO;GO;157382827.88;52460942.626666665;27034657.72623613
CAIXA DE ASSISTÊNCIA DOS EMPREGADOS DO BANCO DO ESTADO DO RIO GRANDE DO SUL;RS;462970464.78999996;154323488.26333332;84617304.57286216
CAIXA DE ASSISTÊNCIA DOS EMPREGADOS DO BANEB;BA;72669812.09;24223270.69666667;12578577.854019854
CAIXA DE ASSISTÊNCIA DOS EMPREGADOS DO BANESE;SE;53148231.400000006;17716077.133333337;8972219.923580598
CAIXA DE ASSISTÊNCIA DOS EMPREGADOS DO SETOR PÚBLICO DO ESTADO DE GOIÁS - CAEME;GO;8604321.32;2868107.106666667;1630996.6748184357
CAIXA DE ASSISTÊNCIA DOS EMPREGADOS DO SISTEMA FINANCEIRO BANESTES;ES;136502854.01999998;45500951.339999996;23451878.973275214
CAIXA DE ASSISTÊNCIA DOS FUNCIONÁRIOS DO BANCO DA AMAZÔNIA - CASF;PA;103629830.36000001;34543276.78666667;14816823.978525925
CAIXA DE ASSISTÊNCIA DOS FUNCIONÁRIOS DO BANCO DO BRASIL;DF;13009950395.0;4336650131.666667;2291670079.840285
CAIXA DE ASSISTÊNCIA DOS FUNCIONÁRIOS DO BANCO DO NORDESTE DO BRASIL;CE;1036854566.0799999;345618188.6933333;182733759.76491222
CAIXA DE ASSISTÊNCIA DOS MAGISTRADOS DE PERNAMBUCO;PE;67106647.43000001;22368882.47666667;12255688.782323295
CAIXA DE ASSISTÊNCIA DOS SERVIDORES FAZENDÁRIOS ESTADUAIS;CE;167108484.68;55702828.22666667;28038681.767093655
CAIXA DE ASSISTÊNCIA OSWALDO CRUZ;RJ;284519634.69;94839878.23;49656694.51865219
CAIXA DE ASSISTÊNCIA SISTEMA SAÚDE INTEGRAL-SSI SAUDE;RS;90539084.03;30179694.676666666;17075554.000550598
CAIXA DE ASSISTÊNCIA À SAUDE DOS EMPREGADOS DA CODEVASF - CASEC;DF;113371198.47;37790399.49;16733345.69759034
CAIXA DE ASSISTÊNCIA À SAÚDE - CABERJ;RJ;446775438.92999995;148925146.30999997;77927546.67479604
CAIXA DE ASSISTÊNCIA À SAÚDE DO SINDICATO DOS FUNCIONÁRIOS INTEGRANTES DO GRUPO OCUPACIONAL ADMINISTRAÇÃO TRIBUTÁRIA DO ESTADO DE PERNAMBUCO;PE;107477510.28999999;35825836.76333333;19510258.70161918
CAIXA DE ASSISTÊNCIA À SAÚDE DOS SERVIDORES PÚBLICOS DO ESTADO DO MATO GROSSO DO SUL;MS;158227074.42000002;52742358.14000001;27936545.475336317
CAIXA DE ASSISTÊNCIA À SAÚDE DOS TRABALHADORES NAS INDÚSTRIAS METALÚRGICAS, MECÂNICAS E DO MATERIAL ELÉTRICO DE BRUSQUE;SC;21480416.27;7160138.756666667;3902330.1236411068
CAIXA DE PREVIDÊNCIA E ASSISTÊNCIA DOS SERVIDORES DA FUNDAÇÃO NACIONAL DE SAÚDE - CAPESESP;RJ;544873028.4;181624342.79999998;90121184.33694051
CAIXA SEGURADORA ESPECIALIZADA EM SAÚDE S/A;SP;3383135.48;1127711.8266666667;754597.771234028
CAMIM OPERADORA DE PLANO DE SAÚDE LTDA;RJ;6841382.25;2280460.75;1128243.6088234968
CARE PLUS MEDICINA ASSISTENCIAL LTDA.;SP;3256505345.29;1085501781.7633333;595243124.2679814
CARE PLUS ODONTOLOGIA ASSISTENCIAL LTDA.;SP;28359822.29;9453274.096666666;7336332.882904141
CARING SAÚDE ASSISTÊNCIA MÉDICA LTDA.;RJ;9487688.25;3162562.75;1712180.8319073173
CASA DE SAÚDE NOSSA SENHORA DE FÁTIMA  LTDA.;CE;1808567.0;602855.6666666666;323921.37658131385
CEAM BRASIL - PLANOS DE SAÚDE LTDA;MG;10193863.57;10193863.57;0.0
CEDPLAN SAÚDE LTDA EPP;MG;13368158.0;4456052.666666667;2373155.84733972
CEMIG SAÚDE;MG;966542440.7900001;322180813.5966667;166455383.80565462
CENTRAL REGIONAL DAS COOPERATIVAS MÉDICAS - UNIMED CERRADO;GO;218104275.57999998;72701425.19333333;36786009.61464216
CENTRO CLÍNICO GAÚCHO LTDA;CE;707729718.13;235909906.04333332;125758216.37266445
CENTRO DE ENDOCRINOLOGIA DE JUNDIAÍ S/S LTDA;SP;3722610.83;1240870.2766666666;615079.9130499549
CENTRO HOSPITALAR ATIBAIA LTDA.;SP;179642797.77;59880932.59;33557210.80752036
CENTRO TRASMONTANO DE SAO PAULO;SP;1204969704.83;401656568.27666664;210117099.799335
CIRCULO OPERARIO CAXIENSE;RS;429463961.84000003;143154653.9466667;74931241.58638422
CLINIPAM CLINICA PARANAENSE DE ASSISTENCIA MEDICA LTDA;CE;1272350800.94;424116933.6466667;229307789.84808508
CLÍNICA SÃO GABRIEL S/S LTDA;SP;201170.7;67056.90000000001;45012.33926429841
COMSEDER - COOPERATIVA DE ASSISTÊNCIA MÉDICA DOS SERVIDORES DA SUPLAN E DO DER LTDA;PB;12937593.76;4312531.253333333;2204129.161793703
CONFERÊNCIA SÃO JOSÉ DO AVAÍ;RJ;75505113.0;25168371.0;14843311.829838175
CONFIANÇA ASSISTÊNCIA MÉDICO HOSPITALAR LTDA;MG;17141595.19;5713865.0633333335;3053577.746283987
COOPERATIVA CENTRAL UNIMED DE COOPERATIVAS DE ASSISTÊNCIA À SAÚDE DO RIO GRANDE DO SUL LTDA.;RS;684052573.49;228017524.49666667;120866951.37053272
COOPERATIVA DE TRABALHO MEDICO DE ARAGUAÍNA - UNIMED ARAGUAÍNA;TO;138704209.04;46234736.346666664;24219442.170565747
COOPERATIVA DE TRABALHO MEDICO REGIÃO DO PLANALTO SERRANO;SC;189163181.48000002;63054393.826666676;34578247.58284796
COOPERATIVA DE TRABALHO MÉDICO DE POUSO ALEGRE;MG;601181910.28;200393970.09333333;109570906.09866184
COOPERATIVA DE TRABALHO MÉDICO DO PLANALTO NORTE DE SANTA CATARINA LTDA;SC;128215391.16;42738463.72;21718726.57669765
COOPERATIVA DE TRABALHO ODONTOLOGICO - UNIODONTO ITAJUBÁ;MG;4776336.3;1592112.0999999999;897662.1421948291
COOPERATIVA DOS USUÁRIOS DE SERVIÇOS DE SAÚDE DO VALE DO RIO DOS SINOS LTDA;RS;37957621.89;12652540.63;6391730.462173605
COOPERATIVA DOS USUÁRIOS DE SERVIÇOS DE SAÚDE LTDA.;RS;35178256.1;11726085.366666667;6594056.438245368
COOPERATIVA ODONTOLÓGICA DO ESTADO DO AMAPÁ;AP;7181263.69;2393754.5633333335;1274831.0467604876
COOPERATIVA ODONTOLÓGICA POÇOS DE CALDAS;MG;8894821.29;2964940.4299999997;1460557.248471901
CROWN ODONTOLOGIA DE GRUPO LTDA;SP;1643257.91;547752.6366666666;299845.9531438036
DENTAL CENTER LTDA;PB;7151462.48;2383820.8266666667;1236720.0226995626
DENTAL GOLD ASSISTÊNCIA ODONTOLÓGICA LTDA.;PB;5397842.31;1799280.7699999998;885163.7732296982
DENTAL MASTER LTDA - EPP;AL;6436806.1;2145602.033333333;1054120.8163836263
DENTAL PLUS CONVÊNIO ODONTOLÓGICO LTDA.;SP;5464937.220000001;1821645.7400000002;985243.6375772897
DENTAL UNI - COOPERATIVA ODONTOLÓGICA;PR;92725327.44;30908442.48;16290764.469061371
DENTALPAR ASSISTÊNCIA ODONTOLÓGICA EMPRESARIAL LTDA.;SP;7945314.46;2648438.1533333333;1424113.700832853
DESBAN - FUNDAÇÃO BDMG DE SEGURIDADE SOCIAL;MG;34495979.21;11498659.736666666;5927313.705955529
DOCTOR CLIN OPERADORA DE PLANOS DE SAÚDE LTDA.;RS;563202408.78;187734136.26;105064582.84759547
DONA SAÚDE CLINICAS LTDA ;SP;10390655.91;3463551.97;272580.24876457057
ECONOMUS INSTITUTO DE SEGURIDADE SOCIAL;SP;617324370.81;205774790.26999998;113308917.65243314
ELETROS SAÚDE - ASSOCIAÇÃO DE ASSISTÊNCIA À SAÚDE;RJ;144254841.31;48084947.10333333;27079516.788071867
ELITE SAUDE SERVICOS MEDICOS LTDA.;SP;0.0;0.0;0.0
ELOSAÚDE - ASSOCIAÇÃO DE ASSISTÊNCIA À SAÚDE;SC;216174296.74;72058098.91333334;37156421.423130706
ESMALE ASSISTENCIA INTERNACIONAL DE SAUDE LTDA.;AL;130389989.32000001;43463329.77333333;21913579.32877227
ESPLENDOR ADMINISTRADORA DE BENEFÍCIOS LTDA.;DF;0.0;0.0;0.0
EVANGELICO SAUDE LTDA.;PR;37912531.599999994;12637510.533333331;6375720.082229884
EXCELÊNCIA PLANO DE SAÚDE S/A;ES;831396.27;415698.135;539282.5173591401
FEDERAÇÃO DAS COOP ODONTOLÓGICAS DO ESTADO DE SANTA CATARINA;SC;42115563.08;14038521.026666665;7892833.203188426
FEDERAÇÃO DAS SOCIEDADES COOPERATIVAS DE TRABALHO MÉDICO DO ACRE, AMAPÁ, AMAZONAS, PARÁ, RONDONIA E RORAIMA;AM;51261694.46;51261694.46;0.0
FILOSANITAS SAUDE LTDA;SP;47390800.28;15796933.426666668;8870106.082048006
FUNASA SAÚDE;PB;30367580.68;10122526.893333333;5410403.278182214
FUNDACAO CAPITAL PREVIDENCIA E SAUDE - CAPITAL PREV;ES;44582374.95;22291187.475;10515756.49228332
FUNDACAO LEONOR DE BARROS CAMARGO;SP;116706558.4;38902186.13333333;21291826.006320506
FUNDAÇAO COMPESA DE PREVIDENCIA E ASSISTENCIA - COMPESAPREV;PE;191722536.87;63907512.29;35438411.667119846
FUNDAÇÃO AFFEMG DE ASSISTÊNCIA E SAÚDE - FUNDAFFEMG;MG;290975388.44;96991796.14666666;49136722.63098673
FUNDAÇÃO ASSISTENCIAL DOS SERVIDORES DO MINISTÉRIO DA FAZENDA;DF;2264097859.21;754699286.4033333;356183969.7500761
FUNDAÇÃO CELESC DE SEGURIDADE SOCIAL - CELOS;SC;385102402.81;128367467.60333334;70295007.20335315
FUNDAÇÃO CESP;SP;2699198045.07;899732681.69;485767657.08300894
FUNDAÇÃO CHESF DE ASSISTÊNCIA E SEGURIDADE SOCIAL;PE;514631906.24;171543968.74666667;98986861.94455445
FUNDAÇÃO COPEL DE PREVIDÊNCIA E ASSISTÊNCIA SOCIAL;PR;642800138.53;214266712.84333333;112229637.2773954
FUNDAÇÃO DE ASSISTÊNCIA À SAÚDE DA ASSOCIAÇÃO DO MINISTÉRIO PÚBLICO DO RIO GRANDE DO SUL;RS;58421076.129999995;19473692.043333333;11395734.44574216
FUNDAÇÃO DE SAÚDE ITAIGUAPY;PR;173775632.05;57925210.68333334;32356056.485214207
FUNDAÇÃO DE SEGURIDADE SOCIAL DA ARCELORMITTAL BRASIL - FUNSSEST;ES;154395998.75;51465332.916666664;22790437.178114545
FUNDAÇÃO FIAT SAÚDE E BEM ESTAR;MG;243461950.87;81153983.62333333;43612001.610112585
FUNDAÇÃO FILANTRÓPICA E BENEFICENTE DE SAÚDE ARNALDO GAVAZZA FILHO;MG;67182066.50999999;22394022.169999998;11993645.541284151
FUNDAÇÃO LIBERTAS DE SEGURIDADE SOCIAL;MG;101370209.47;33790069.82333333;16874293.869065274
FUNDAÇÃO PLAMHUV - PLANO MÉDICO HOSPITALAR DOS HOSPITAIS UNIDOS DE VIÇOSA;MG;22021778.009999998;7340592.669999999;4248301.858956833
FUNDAÇÃO SANEPAR DE ASSISTÊNCIA SOCIAL;PR;312902056.02;104300685.33999999;53707347.20963958
FUNDAÇÃO SAÚDE ITAÚ;MG;3817544386.81;1272514795.6033332;673745805.5166744
FUNDAÇÃO SÃO FRANCISCO XAVIER;MG;1376207627.65;458735875.8833334;244559712.98977858
FUNDO DE ASSISTÊNCIA MÉDICO-HOSPITALAR DO MINISTÉRIO PÚBLICO;MS;10788738.64;3596246.2133333334;2315968.552059157
FUNDO DE ASSISTÊNCIA À SAÚDE DOS FUNCIONÁRIOS DO BEC;CE;14549612.41;4849870.803333334;2631734.6874478264
G & M ASSESSORIA MEDICA EMPRESARIAL LTDA;RJ;739618.47;246539.49;135567.31487350335
GAMA SAUDE LTDA.;SP;1221993381.0900002;407331127.03000003;184480391.13143384
GARANTIA DE SAÚDE LTDA;SP;132163553.85999998;44054517.953333326;22084507.56043895
GEAP AUTOGESTÃO EM SAÚDE;DF;8611060360.279999;2870353453.4266663;1575556504.2873178
GOCARE PLANOS DE SAUDE LTDA;SP;124817850.15;41605950.050000004;18640828.0964619
GRUPO HOSPITALAR DO RIO DE JANEIRO LTDA;RJ;3526277871.2299995;1175425957.0766666;610581039.0643158
GS PLANO GLOBAL DE SAÚDE LTDA;RJ;75557174.58;25185724.86;13711105.46840596
H.B. SAÚDE S/A.;SP;501016963.58;167005654.52666667;86960228.20670441
HAPVIDA ASSISTENCIA MEDICA S.A.;CE;16490066984.41;5496688994.803333;2950825872.5600953
HBC SAÚDE LTDA.;SP;198288372.63;66096124.21;34837752.39084771
HEALTH ADMINISTRADORA DE BENEFICIOS LTDA;SP;0.0;0.0;0.0
HEALTH-MED SISTEMA DE SAUDE LTDA;RJ;3432498.41;1144166.1366666667;587577.3242454726
HOSPITAIS E CLÍNICAS DO PIAUÍ S/S LTDA;PI;102931097.99000001;34310365.99666667;18102318.02429921
HOSPITAL CESAR LEITE;MG;18433410.83;6144470.276666666;3457572.3949497784
HOSPITAL DE CARIDADE SÃO VICENTE DE PAULO;PR;2552772.79;850924.2633333333;56378.54246150166
HOSPITAL DE PRONTOCLINICA LTDA.;RS;32034317.080000002;10678105.693333333;5358820.199134368
HOSPITAL MATERNIDADE SÃO VICENTE DE PAULO;CE;0.0;0.0;0.0
HOSPITAL S.P. LTDA.;RS;17254605.509999998;5751535.169999999;2816500.111574606
HSMED SAUDE LTDA;RJ;5819063.140000001;1939687.7133333336;1048441.6937308799
HUMANA SAÚDE LTDA.;PR;620485163.21;206828387.73666668;102198138.69370566
HUMANA SAÚDE NORDESTE LTDA. ;PI;1589461626.53;529820542.1766667;278507673.53587914
INFINITY SAÚDE SUPLEMENTAR LTDA;MT;1520550.8800000001;506850.2933333334;364756.33860910416
INNOVA PLANO DE SAUDE LTDA;RO;1723509.58;861754.79;783899.2281616452
INSTITUIÇÃO BENEFICENTE CEL MASSOT - IBCM;RS;98913688.97;32971229.656666666;19591672.371346157
INSTITUTO CURITIBA DE SAÚDE;PR;707166666.27;235722222.09;129114404.1474296
INTEGRA ASSISTENCIA MEDICA SA;SP;416455711.71999997;138818570.57333332;55840532.3401889
INTERCLINICAS PLANO VIDA USA OPERADORA DE SAUDE LTDA;SP;0.0;0.0;0.0
INTERMEDICI PIRACICABA ASSISTENCIA MEDICA LTDA;SP;71072227.51;23690742.503333334;13276239.38216688
IRMANDADE DA SANTA CASA DE MISERICORDIA DE LIMEIRA;SP;132507259.47999999;44169086.49333333;23379829.367653314
IRMANDADE DA SANTA CASA DE MISERICÓRDIA DE PASSOS;MG;87298069.50999999;29099356.50333333;15139318.97844622
IRMANDADE DA SANTA CASA DE MISERICÓRDIA DE PIRACICABA;SP;323476234.39;107825411.46333332;63168525.06827894
IRMANDADE DA SANTA CASA DE MISERICÓRDIA DE RIO CLARO;SP;185035529.25;61678509.75;34455778.393020496
IRMANDADE DA SANTA CASA DE MISERICÓRDIA E MATERNIDADE DONA ZILDA SALVAGNI;SP;46880520.58;15626840.193333333;8102396.69680799
IRMANDADE DE MISERICORDIA DE PORTO FERREIRA;SP;73679846.01999998;24559948.67333333;13559791.720210068
IRMANDADE DE MISERICÓRDIA DO HOSPITAL DA SANTA CASA DE MONTE ALTO;SP;89978220.51;29992740.17;15833081.010405075
IRMANDADE SANTA CASA DE MISERICÓRDIA DE MARINGÁ;PR;221043528.29;73681176.09666666;39962671.52255214
ITAUSEG SAÚDE S.A.;SP;500979057.33000004;166993019.11;84774739.80909668
